content,score,thumbsUpCount,at
오랜만에 접속하니 로그인이 풀렸다는 알림창이 뜨면서 계속 로그인이 풀리는 현상이 있습니다. 노트20울트라/안드로이드버전11/앱 최신버전으로 업데이트 완료했으며 문의하기 접속 시에도 해당 현상 발생되어 부득이하게 리뷰에 남깁니다. 답변 부탁드립니다.,5,22,2021-07-12 19:33:42
"쇼핑앱중에 고민되신다면 보세요. 이앱 진짜 좋습니다! 나는 20살인데 키가작아서 왠만한 쇼핑몰에서 사는건 불가능하다.하시는분도 이앱은 10대,20대,30대 연령설정이 가능하고 가격설정도 가능,카테고리설정 색감설정도 가능하답니다! 그리고 모아보기에는 자기가 원하는 옷을 모아볼수도있고 스토어도 많습니다!장바구니 폴더설정도 편하고요!가입시 10만원 할인쿠폰도 주니 너무너무 좋습니다♡♡ 단점? 그게뭐죠? 먹는건가요? 이앱은 단점도 없습니다 !!",5,6,2021-08-12 08:01:56
쇼핑몰 즐겨찾기 해놓은곳은 신상올라오면 볼수있는탭이 있었는데 업뎃하구 없어졌네요 업데이트 이후 포토후기는 너무 오래걸려 로딩중이고.. 와이파이 5G 두개 다 그래요 신상 볼수없는게 제일 불편해요,3,1,2022-04-27 12:16:09
"모바일 UI가 매우 불안정하고, 배송도 늦네요. 품절인 상품이 계속 검색되고요",3,1,2021-06-23 19:20:41
아니 앱은 전체적으로 좋은데요...제가 핸드폰 보다 컴퓨터 사용을 더 자주하는데 지그재그는 PC로 사용이 안되서 좀 불편한데... PC사용도 할 수 있게 해주시면 안될까요?,4,3,2019-06-02 21:26:05
"atc,악세사리 등 확 끌리는 어플이 없는 유목민이였는데요 기대없이 이용해봤는데 무료배송 상품도 많고 상품군이 다양 하네요 일례로 타앱은 폰케이스가 저렴하긴 하나 아기자기한 상품만 즐비 해 있다면, 지그재그는 심플한 상품,아기자기한 상품,유니크한 상품 등 조금 더 데이터가 방대하고 경쟁력 있는 느낌?이네요 이 어플로 정착하려구요 ☺️",4,10,2021-08-02 16:11:29
지금까지 꾸준히 사용해오던 사람인데요 원래는 상품 하나에 들어가면 그 브랜드의 다른상품들도 볼수있게 떠있었는데 이젠 그냥 한가지만 볼수있게 바뀌었네요 너무 불편합니다 옛날 그대로 다시 바꾸어주시면 좋겠어요,4,1,2020-05-08 04:58:38
완전좋아요ㅠㅠ!!😭😍 쇼핑몰 모아있는거도 좋고 쇼핑몰회원가입할때 편리하게 할수 있도록 만들어주신거 완전 좋아요ㅠㅠ 옷고르고 옷구경?할때 진짜편리하구 조아용 자주 애용할게용 ㅠㅠ!!😍❤❤❤,5,6,2019-08-03 17:17:59
진짜 너무 화나요 로그인이 원래는 돼야 하는데 계속 안되고 구글로 로그인 되어있는데 메일 받으면 로그인 정보가 없다고 하고 결제하고 싶은데 로그인하면 사게 해줄게ㅋ 이것도 아니고 진짜 비 회원 로그인도 제발좀 만들어 주세요!!!! 진짜 개 빡쳐서 그냥 지그재그 방치중ㅡㅡ,2,1,2023-02-16 19:19:53
최근들어 무한로딩이 많이 걸려요ㅠㅠ 그리고 다른어플 카톡이나 인터넷같은거 들어갔다와도 사진 로딩이 안되구요 그거외엔 잘 쓰고있어요!,4,0,2019-12-11 00:54:41
인터넷과 와이파이는 아무 문제 없는데 매번 로딩 문제로 버벅거리는 이유가 뭔가요?쇼핑을 하려해도 사진이나 내용이 떠야 쇼핑을 하겠지요!^^참다참다 화가나서 리뷰 올려봅니다 하,1,0,2022-05-16 22:05:10
"유명 쇼핑몰들 순위를 한 번에 볼 수 있고 각 쇼핑몰 홈페이지에 들어갈 수 있다는 것이 장점이다. 또한, 몇몇 쇼핑몰에서 지그재그 회원용 쿠폰을 주는 것도 좋다.",5,1,2020-12-02 21:45:00
굿인데 가격필터링 할때 할인된 가격으로 필터링좀 plz 개불편ㄴ;; 그리고 필터 종류좀 상품에 맞게해줬음 좋겠음 예를 들어 폰케 같은거엔 투명이 없어서 좀 불편함,4,0,2022-05-22 02:58:48
온라인으로 옷살때는 지그재그 사용해서 사는것같아요 ! 진짜 그냥 보는것도 재미있고 옷 구경하는것도 재미있네요 ❣ 시간때우거나 옷 구경&구매하기 좋은 어플같아요 ! 잘 사용하고있습니다 😊,5,13,2020-02-16 20:29:39
지그재그에선 옷을 살때도 정말 편해서 좋고 잘 쓰고 있습니다.하지만 하나 아쉬운건 옷을 살때 배송비가 다 각각 붙여져서 너무 불편해요.그것만 빨리 바꿔주세요,3,3,2019-11-27 16:42:54
업데이트 후 앱 관리자가 확인했는지 검토가 필요해 보입니다. 광고 배너 끄기도 안되고 광고페이지로 넘어가기만 되는데 배너가 페이지를 가려 다른 페이지 구경도 못하게 만들어놨음.,1,8,2021-09-04 00:27:37
옷을 고를 때 카테고리별로 나뉘어져있어서 편해요 다만 리뷰를 볼때 키나 몸무게별로 골라서 따로 보는게 있었으면 합니다,4,3,2021-11-27 21:55:16
별점 한개도 아까움.... 쇼핑몰 모음앱이여서 한번에 쇼핑몰이 구경가능한데 그만큼 고객관리가안됨 너무 불편함 내가 하나하나 다확인해야하나...저는 다시는 이용안할것같음,1,2,2019-10-25 11:08:02
앱 사용은 좋았지만 어제까지 잘 썻는데 갑자기 로그인이 풀려서 배송시작된곳이어떻게 되었는지도 모르고있어요.다시 로그인을해도 계속 풀립니다.,1,0,2023-01-27 16:37:46
"버그 있어요. 16일에 15 출석 채웠는데 룰렛이 오류 뜨면서 안되네요. 하루 더 지나서 17일인데, 이제 7일 남았네요...체팅문의도 파일이 안가서 리뷰에 남겨요. 버그수정 부탁드려요..",4,0,2023-08-19 13:38:03
매우 편리. 개선사항 여기 적어도 전달되나요? 하트표시한 옷을 쇼핑몰 별로 볼 수 있잖아요 근데 거기 검색기능도 없고 가나다 순도 아니라서 찾기가 너무 힘들어요 개선해주세요ㅠㅠ제발요,4,172,2019-11-29 21:58:56
설치 안된다고 리뷰남겼었는데...설치됐어요!! 핸드폰 상의 문제였네요 죄송합니닷.. 앱을 통해서 다양한 쇼핑몰들 한번에 볼 수 있어서 너무 좋은 거 같아요 감사합니다,5,0,2022-09-13 20:39:52
잘 쓰고 있는 앱입니다 제 스탈 옷도 많아서 좋았구요 ㅎㅎ 근데 찜한 상품들을 사는데 드는 비용을 모두 합할수 있는 기능이 없어서 아쉽습니다 ㅠㅠ,4,0,2020-09-12 20:55:25
"리뷰를 잘 확인해주시고, 잘 알려주셔서 감동입니다 ㅎㅎ 예쁜 옷 많고, 가격도 저려미저려미 해서 한철입기 좋은 옷들 많이 파네요😊 배송도 무쟈게 빠르고! 앞으로도 자주 애용하겠습니다 ㅎㅎㅎ",5,4,2021-01-23 13:50:48
"쇼핑은 지그재그에서만 몇년째 하고 있지만 갈 수록 느려지고 튕김현상이 자주 발생하네요 ㅠㅡㅠ 흑흑,, 수시업데이트를 하는데도 버벅임이 심하니 답답한 감이 있어요!",4,4,2021-05-31 13:47:31
상품 눌렀다가 뒤로가면 새로고침되는거 너무 불편해요 옵션 선택한것도 다 초기화되고... 가끔은 안건드렸는데도 혼자 새로고침돼서 밑에 있는 상품들은 볼수가 없네요,2,0,2022-09-30 11:44:27
잘쓰고있어요 상위노출상품 가서 시키니 사람이 몰렸는지 부츠배송을 3주넘게 기다렸음... 앱업데이트되서 업뎃하고 지그재그 회원가입하려고하니 문자인증번호 제대로넣어도 틀리다면서 가입못함.. 3번실패해서 포기..,4,1,2019-11-30 11:19:16
네트워크 연결 안된다고해서 재설치했는데 이번엔 튕기는 현상이 있네요. 리뷰 보니까 대다수가 그런 것 같은데 조치가 필요할것같네요. 자꾸 재설치 해야하니 불편해서 못쓰겠어요,1,2,2021-04-06 23:49:22
"사이즈 목록이 있었음 좋겠어요. 제가 44에 24입다보니 치마라고 쳐서 들어가면 수많은 치마중에 사이즈없는게 수두룩하고 상의또한 마찬가지네요. 검색창에 44, 150이라쳐도 옷 판매자가 이름을 그렇게 정하지않는 경우가 많아 찾기도 힘들구여. 개선부탁드립니다",3,21,2020-04-13 07:09:35
별로 좋은기능운 없는것같네요 쿠폰같은 그런것도 정말 적은것같고 가장 바뀌었으면 좋겠는건 반품요청 했는때 그게 수락되면 알람이 좀 울렸음 좋겠네요. 제가 항상 거기에 수시로 들어가볼순 없잖아요. 아침 6시에 택배 가지러갈거라고 문자 하나 오고 자다가 아무것도 몰라서난리였네요.,2,16,2021-08-28 10:46:45
전에는 그러지 않았는데 상품 하나를 보고 뒤로가기를 누르면 스크롤이 다시 제일 처음으로 올라가서 너무 불편해요... 그리고 밑으로 스크롤하는데 옆 카테고리로 자꾸 휙휙 넘어가서 빡침,3,3,2022-01-08 20:09:26
한번 쇼핑하고 다신안함ㅋㅋ 맘에드는 옷이있어서 무료배송할라고 오만원채웠는데ㅋㅋ 맘에드는옷은 풀절이라고 취소시켜버리고 다른옷두개만왔는데 그것도 무슨걸레짝인지ㅋㅋㅋ 입지도 않고 버렸음ㅋㅋ,1,0,2020-08-10 14:52:50
주문한지 16일 지나도 배송이안되요. 배송 느려도 넘 느려요. 5일안에는 배송 된다는 거짓문구만있네요. 결국 취소... 취소도 3일 걸림ㅡㅡ 별하나도 아까움,1,2,2022-01-16 22:28:35
어플 개 무겁고 너무 느려요 상세페이지도 안뜨고 ... 와이파이도 바꿔보고 데이터도 켜보고 앱 업뎃도 하고 그래도 페이지도 안 뜨고 ㅠ 속에 천불나서 못쓰겠어요,1,0,2023-06-14 22:59:55
"로딩 너무 느리다 진짜진짜 너무너무 느림 사진이나 gif 압축을 안하시나봐요,,, 그래서 제거하고 다른 어플로 갈아탑니다",1,1,2022-06-02 09:14:31
왜 본인인증하기를 눌러도 아무반응이없나요. 그리고 네이버 2시간 이벤트응모하려는데 로그인을 100번을해도 응모하기가 안눌리고 다시들어가면 로그인하라는것만뜨고^^ 너무하네요.,2,5,2021-01-16 10:45:55
몇년 째 잘 쓰고는 있는데 서버가 너무 자주 터져요 접속이 안될때가 꽤 잦아요 안정성에 문제가 있는 듯 합니다.,3,1,2023-05-16 12:19:45
"여러가지 쇼핑물과 정보를 모아두어서 간편하고,사용자의 의견을 적용할려는 점에 칭찬드리고싶습니다.또한 포인트를 주는등의 이벤트등을 자주 열어서 굉장히 만족하며 잘쓰고있습니다!",5,1,2020-01-24 21:19:46
자꾸 다른창으로 이동이 되고 가끔은 장바구니에 넣어놨는데 안넣어져 있어서 다시 찾아야 해서 불편해요. 개인적으로는 비추천 합니다.,1,0,2022-05-14 22:26:20
여러분 이거 짱좋아요. 근데 처음써보는 분들은 쬐~~~끔 어려울 수⤴도 있.는.데..! 사용하다 보면 쉽기도하고 편하게 쇼핑할 수 있는 고런 앱인거 같으니까...!아참 옷도 너~~~~무 이쁘니까 사용해보해요!!,5,3,2019-02-12 20:35:30
"로그인을 분명히 했는데 왜 주문이 안되나요,,,?? 로그인 했고 상품을 주문하려 하니 로그인 창이 떠요 그래서 비밀번호를 입력을 하면 로그인이완료되었습니다 하고 문장이 뜨고 주문을 하려하묜 또 로그인 하라는 비번창이 뜹니다. 무한반복이에요. 그래서 마이페이지 들어가니까 로그인이 되어있는 상태입니다. 왜이럴까요",2,8,2021-09-24 07:08:43
나쁘지 않아요. 제가 여태까지 써본 쇼핑몰 중에서는 지그재그가 제일 닌 것 같아요 z결제 시스템도 마음에 들고 검색기능도 맘에 들어요. 한가지 아쉬운 점은 좀 더 다양하고 이쁜 맨투맨과 니트가디건이 있었으면 좋겠어요,4,1,2020-02-06 10:20:51
"색다른 쇼핑몰에서, 다른 옷들을 한꺼번에 볼수있어서 좋아요. 카테고리도 다양하고, 가성비가 대박입니다.",5,1,2019-10-23 03:20:25
재고 한두개 갖다놓고 짠 특가합니다! 광고해놓고 열자마자 바로 품절이네요같은 비열한짓은 안했으면 좋겠음..,1,0,2023-07-07 12:03:46
신상 몰아보기 메뉴 만드신분 !!!!최고!!!!! 지그재그 쇼핑하기좋고 점점더 편리하게 변하네요!!! 아진짜 신상 몰아보기 만드신분 칭찬좀해주세요♡♡♡,5,1,2020-02-10 21:37:56
지그재그로 굉장히 많이 사용해서 지금도 vvip고 다음달 예상도 vvip인 유저입니다 지금까지 몇 백은 쓴 거 같아요 쿠폰도 많이 들어오고 한 번에 보는 게 편해서 배송비 붙는 거 감안하고 자주 썼는데 구매한 곳 중 한 곳에서 일방적으로 취소했는데 5천원이 차감된 채 환불이 되어 보니 쿠폰 때문이라네요 하나 취소하면 쿠폰이 아예 취소되는 걸 알아서 무엇도 취소하지 않고 있었는데 전화가 온 것도 아니고 제가 취소한 것도 아닌 갑자기 구매한 곳에서 일방적으로 제품 취소 한 건데 산 금액에서 갑자기 5천 원 차감된 채 환불이 되니 어이가 없네요 그냥 제가 지그재그를 사용 안 하면 되는 문제인 것 같아요 앞으로는 지그재그 이용 안 할 것 같습니다,1,5,2020-06-23 15:14:24
진짜 좋아요! (?) 이 앱 깔고 네이버로 하나하나 쇼핑몰 치던 내가 초라해졌어요. 지그재그에 다 있네요 허허.. 근데 하나 아쉬운건 찜해논 상품 합계 가격이 나와있었으면 좋겠어요ㅜㅜ 그것때매 항상 계산기 두드립니더..ㅋㄱㅋ,5,36,2019-08-25 20:28:12
"고객센터 문의하는게 너무힘들고, 교환이나 반품시에도 판매자에게 문의남겨 처리해야하는게 불편해요. 실질적으로 나는 지그재그에서 샀는데 교환,반품우 알아서해라~~하는것같은 느낌이네요.. 쿠폰도 좀 많이 행사했으면좋겠습니다! 매주월요일 마이픽! 쿠폰이벤트는 넘좋아요~~!!매주 어떤쇼핑몰일지 기대도되고ㅋ 기다려지더라구요",3,30,2022-02-03 23:01:36
직진배송이 그 직진배송이 아님.. 기다리는거 지침. . . (수정) 직진배송이래서 주문했는데.. 3일차. 아직 배송준비중이라길래 취소했음 그냥 타 쇼핑몰 플래폼 앱에서 같은제품을 어제 20시 주문했는데 오늘 배송된다고 문자옴.,1,1,2022-07-20 09:20:14
항상 지그재그 편리하게 잘 사용하고 있습니다❥ 혹시 구매할 때 한 번 등록한 계좌는 취소 못하는건가요?? 삭제한 계좌라 더 이상 사용하지 못하는데 어떻게 등록취소해야할지를 모르겠어요ㅠㅠㅠㅠ,4,3,2021-05-15 21:47:57
다 좋은데 먹통이 좀 심해요 3~5분 마다 한 번씩 화면이 멈춰버리고 계속 앱이 중지됐다고 뜨네요 이 점만 보수되면 별5개 입니다,4,2,2020-03-15 16:56:05
"지그재그 해당 앱에 있는 업체들 거의 대부분 배송 지연도 많고 배송이 늦어져도 왜 늦는지 안내도 없고 배송이 되서 와도 제품상태가 ...ㅎ 진짜 몇번 주문했었지만 한번인가 빼고 다 배송지연, 지연안내없음..",1,0,2023-05-08 12:04:56
다름이 아니라 앱에 들어가면 자꾸 튕겨지네요 상품 눌러서 이미지 나올때까지 다 안뜨면 화면이 흰색창으로 넘어가요 왜 이런걸까요ㅠㅠ,4,1,2020-10-23 09:39:40
쇼핑몰은 한 번에 볼 수 있다는 편리함이 있어요 근데 모아보기로 볼 때 사진 로딩이 느려요ㅠ 30초에서 1분 정도 기다려야 나오기도 한답니다ㅠ,3,1,2019-03-27 08:45:26
스크롤 하면서 내리고 있는데 계속 위로 올라가지고 신상품순으로 보고 있었는데 위로 다시 올라가더니 필터가 초기화 되네요,1,0,2022-09-30 01:22:18
결제 하려고 하니까 보안프로그램 설치하라길래 수동설치 눌렀는데도 안 되고 렉도 심하고 결국 10분간 하다가 못 했네요. 솔직히 말하면 별 하나도 아깝습니다.,1,21,2022-02-28 00:03:51
아직까지 유일한 단점이 있다면.. 퇴근하고 앱으로 옷만 보고있다는 것.. 다양한 회사 옷들을 모아놓아서 스타일이 제한되지도 않고 가격에 대한 기준들도 쉽게 세울 수 있게 돼요!! 흑 돈을 많이 벌고싶다..,5,16,2019-01-18 23:40:00
리뷰 처음 써보는데 너무 불편해서 남기겠습니다 결제할때 만 14세 이상인줄 모르고 그냥 결제를 했는데요 만 14세는 안된다고 하셔서 아빠 번호로 다시 했는데 다시 그 문자가 뜨는거예요;;그래서 앱 지우고 다시 깝니다. 그리고 저 같이 키가 작고 몸무게가 별로 안나가는 사람들이 종정 있을텐데 옷 살때마다 사이즈가 없어서 너무 슬픕니다ㅜㅜ 특히 바지! 이 부분만 고치면 좋을듯 합니당!!,2,12,2021-08-29 23:06:59
너무 잘쓰고있어요 ! 모든 쇼핑몰이 한눈에 보여서 너무 좋아요 ㅠㅠㅠ 근데 배송비가 많이 부담되는데 이것만 고치면 대박일듯,5,2,2018-12-14 19:27:37
전엔 비슷한 옷 잘찾아줬는데 이젠 아예 못찾거나 색만똑같은걸 추천해줘서.. 그리고 제가 못찾는건지 모르겠는데 품절상품 제외하고 보게하는 기능은 없나요..,3,0,2022-07-24 21:43:15
한눈에 볼 수 있고 할인도 많이 받을 수 있어 좋아요 기능적이고 편리해서 좋은데 너무 느리고 자주 튕겨서 답답해요,3,1,2021-11-24 13:03:41
결제완료에서 배송준비중으로 자동변경 되는 판매자 기능 좀 제발 없애주세요 공휴일에도 이런 식으로 자동변경 되니까 취소하고 당일 재구매해야 하는 상황일때 아주 불편합니다 배송준비에 실제로 들어갔을때 배송준비중으로 변경이 되어야 정상인거죠 (공휴일에도 쇼핑몰 사장님들이 일하는거 아니잖아요),5,0,2022-10-14 14:48:56
상품 선택해서 설명보려고 스크롤 내리면 엄청 튕깁니다. 한두번이 아니라 매번 그래서 매우 짜증납니다,2,0,2023-03-22 23:15:10
쇼핑앱중 가장 최고에요!편리하고 가장 쉽고 빠르게 옷찾기 좋아요! 하지만 요즘 저장되어있는 옷이많으면 느려지는 것만 개선되면 더 좋을듯요👍,4,3,2018-10-09 12:30:21
코트 득템했어요. 가격대 설정 기능도 편하고 좋은듯. 쇼핑몰이 더 많아지면 좋겠어요,5,0,2019-02-23 17:14:28
상품 전체보기는 가능한데 상품 상세설명 보려고 누르면 로딩중만 뜨고 안되네요. 업데이트 문제인가 싶어서 업데이트 해도 안되네요. 장바구니 넣기도 안되고 찜도 안되고 이게 뭔.....쿠폰 쓰지도 못해요....,1,0,2023-06-14 22:47:37
반품 배송비 지불하는 건 이해가 되는데요 같은 배송지로 두개의 상품을 반품하려고 하면 각각 배송비가 요구가 되더라고요? 왜 이런 방법으로 진행되는지 진짜 별로네요,1,0,2022-08-30 09:43:27
솔직히 처음에는 이게 뭐지?약간 이렇게 생각하다가 계속 사용해보니깐 되게 편하고 자신이 살 수 있는 옷을 이렇게 맘대로 골라서 옷도 사고 가격도 자신이 정하는데로 할 수 있어서(?)정말 편하고 재밌을때도 있구 어쨌든 너무너무 편하고 옷 사는거 걱정도 안되요♡♡♡♡♡,5,1,2019-01-18 13:57:11
"장바구니에 상품을 담아도, 장바구니 아이콘을 누르면 아무것도 담겨있지 않다고만 뜹니다. 빠른 수정 요구합니다. 물건을 살래야 살 수가 없게 해놨네요.",1,0,2023-02-21 01:23:05
다양한 쇼핑몰을 한눈에 볼 수 있게 만들어서 좋구 따뜻한 아우터부터 블링블링한 악세서리까지 한번에 쇼핑 할 수 있게 되어있어서 좋습니당,5,0,2019-12-11 23:21:37
앱 실행안돼서 리뷰남겼고 시스텝 웹뷰 안내해주셔서 그대로 시행했지만 계속 동일한 문제가 발생해요 그리고 앱 건의 남기고싶지만 어플 튕겨서 못남겨요 다른 동종업 어플은 문제가없는데.. 다시깔고 삭제하고 반복하다보니 너무 스트레스라..,1,2,2021-03-31 23:38:33
정말 좋아요 ! 만약 예시로 체크남방 이렇게 쓰면 좌라라락 예쁜거 다 나오고 필터 검색으로 더 정확하게 검색항 수 있어서 더 좋은것같삽니다!,5,1,2018-09-15 22:20:59
갑자기 다음달 예상등급도 사라져서 확인해보려고 공지사항 보고 왔는데 혜택이 정말 많이 적어지네요 ㅋㅋㅋㅋ 은근슬쩍 리뷰포인트 전보다 적게주는거랑 글자수제한 올린건 그러려니했는데 멤버십 등급 기준은 컷이 한번에 너무 오른거 아닌가요?? 다 두 배 이상씩... 전보다 쿠폰 할인률이랑 개수도 다 적은데 ㅋㅋㅋ멤버십 쿠폰이랑 포인트때문에 이용한 앱인데 이젠 이 앱을 이용할 이유가 없네욥^^^^^킹받아서 떠나렵니다,2,1,2022-08-23 17:23:16
비슷한 상품 검색할 때 가격대도 좀 필터링해서 볼 수 있는 기능이 잇었음 좋겠네요 대부분 비싼 것만 떠서..,4,1,2019-11-14 14:50:27
쇼핑몰 사이트에 직접 들어가는것 보다 지그재그에서 쿠폰적용하면 더 싼 경우가 많네요~~~유용하게 사용하고 있습니다:),5,0,2023-03-16 09:12:20
"이게 다좋은데.... 수량을 1개로 했는데 구매할려고 아이디 이런거 적는데에 가보면 자꾸 수량이 2,3,4,5,6,7 개로 자꾸 늘어요;; 그러면서 가격도 같이 늘어나고... 저만 그런가요? 이거왜이러죠...",3,3,2020-01-19 15:38:55
다른거 다 괜찮고 좋은데 관심상품에서 해제할려면 일일이 다 해야되서불편해요 한두개 정도면 괜찮은데 여러개를 빼야할때 너무 불편해요 관심상품에서 삭제기능이 있으면좀더좋을것 같아요.,4,0,2019-05-04 09:20:16
쇼핑몰들의 문제지만 항상 구매가 원활하게 안되요 뒤늦게 품절되는게 많고 처리도 빠르게 안되고.. 자주 이용할것 같지 않아요,1,0,2019-09-20 21:56:07
찾으려는게 잘 안찾아지네요 광고에서는 막 쉽게 찾을수있단듯이 나오더니 어려운것도아니고 아이보리랑 하늘으로 매치된 오프숄더 밑지장단있는 원피스 아무거나 찾는데 하나도 안뜨네요 요즘 거리에서 자주보여서 이뻐서 사고팠는데...1시간을 서버를봐도 못찾겠어요,2,17,2020-06-28 16:59:14
쿠폰받으려면 자동으로 즐겨찾기 되는거 때문에 진짜 내가 즐겨찾는 쇼핑몰 찾기가 힘들어짐... 그래서 다른 어플 사용하는 빈도가 더 많아짐...,3,1,2021-10-29 23:56:01
내 상품에 옷 넣을때 폴더에 중복해서 들어가면 좋을 것 같아용 그리고 가격이랑 색깔 설정할때마다 옷 상품이 잘 안떠요,4,0,2019-01-28 18:51:58
"한번에 원하는 디자인,제품을 빠르게 찾을수 있어서 좋구 좋은 쇼핑몰을 알게되는 부분도 좋아요~!",4,0,2018-10-07 20:12:16
다양한 정보도 좋고 편리하고 특히 연령대별 찾을수있어서 좋아요 저희집은 초 중 대 다있거든요 ㅎㅎ,5,0,2019-08-16 08:04:16
계속 로딩중이라는 표시가 떠요 예전에도 종종 그러더니 또 그러네요. 그래서 계속 중간 중간 앱삭제후 재설치 하게됩니다.,1,0,2022-10-24 03:17:47
"옷도 다 이쁘고 소재도좋고, 10대•20대 옷들이 많아서 좋아요🥰 다만,배송이 쫌 느려요ㅠ.ㅠ 그래도 단점보단 장점이많은것같아요",3,1,2021-01-30 23:13:15
"근데 똑같은 하나의 옷이 일반 배송/정상가 가격이 30,300원인데 직진배송 카테고리에 있는 옷으로 사려고 하면 33,800원을 받더라구요..? 일반 배송비가 2,500원인데 거기에 천원 더 얹어서 받으면, 말 그대로 그냥 배송비를 3500원 주면 빨리보내주겠다 이거 아닌가요..? 이러면 정 급한게 아니면 직진배송으로 구매하는 게 불이익이되는데, 딱히 지그재그 측에서는 쇼핑몰의 가격 측정에 대해서는 터치하지 않으시는건가요?",3,1,2023-08-10 00:40:27
지그재그를 pc로 보고싶어서 폰에 있는걸 삭제했어요 pc랑 폰이랑 호환이 된다고 해서.... 그런데 로그아웃을 안하고해서그런지 계속 폰에 설치가 되어있다고 뜨네요. pc로 보고싶으면 어떡해야하나요ㅠㅠ (아 제가 처음 회원가입할때 잘못된 이메일로 가입을 했나봐요 어쩔 수 없이 폰에 다시 깔아서 로그인하려 하는데 이메일이 잘못된이메일이라고 뜨네요ㅠㅠ) 도대체 pc로는 어떻게 사용하나요ㅠㅠ,4,1,2020-06-26 22:50:01
이앱에서 물건이나 옷만 치면 종류도 많고 이쁜것도 많이나와서 좋은것 같아요 ! 가격도 싼것도 많고 ㅎㅎ 추천하는 앱입니다''),5,2,2018-09-29 21:54:16
상품들 검색시 다른 쇼핑몰들은 품절상품들은 검색되지 않는데 여기는 품절 상품들까지 검색되어지니까 불편해요. 어차피 품절되서 살수도 없는데 왜 보여지게 해놨는지... 쇼핑몰이 구매자들에게 더 불편함을 주는것 같아요,1,31,2022-01-20 23:38:53
"좋아요 넘 좋아요bb 제가 인터넷 쇼핑몰로 옷을 사고 싶었는데 여기는 옷 찾기도 편하고, 이쁜옷들, 독특한옷들, 귀여운 옷들 다 있어서 좋아요 지그재그는 뭐니뭐니해도 원하는 옷을 모아볼수있고 가격 색깔 같은 것 도 설정할수 있어서 좋아요",5,5,2019-03-30 23:58:07
